{
  "schemaVersion": "0.1.0",
  "id": "layout.blog-electrical",
  "modelId": "model.blog-electrical",
  "components": [
    {
      "componentId": "pv",
      "x": 20,
      "y": 40
    },
    {
      "componentId": "grid",
      "x": 20,
      "y": 200
    },
    {
      "componentId": "bus",
      "x": 200,
      "y": 100
    },
    {
      "componentId": "battery",
      "x": 200,
      "y": 350
    },
    {
      "componentId": "load",
      "x": 400,
      "y": 40
    }
  ]
}
