{
  "schemaVersion": "0.1.0",
  "id": "layout.ladle-cycle-synthetic",
  "modelId": "model.ladle-cycle-synthetic",
  "components": [
    { "componentId": "burner", "x": 20, "y": 170 },
    { "componentId": "material-source", "x": 20, "y": 20 },
    { "componentId": "refractory", "x": 260, "y": 170 },
    { "componentId": "metal", "x": 500, "y": 20 },
    {
      "componentId": "metal-refractory-contact",
      "x": 470,
      "y": 170,
      "width": 124,
      "height": 58
    },
    {
      "componentId": "refractory-loss",
      "x": 288,
      "y": 330,
      "width": 104,
      "height": 58
    },
    {
      "componentId": "metal-loss",
      "x": 528,
      "y": 330,
      "width": 104,
      "height": 58
    },
    { "componentId": "material-sink", "x": 740, "y": 20 },
    {
      "componentId": "ambient",
      "x": 20,
      "y": 430,
      "width": 884,
      "height": 104
    }
  ]
}
